{
  "$schema": "https://json-schema.org/draft/2020-12/schema",
  "description": "result.json written by fukurou run (schemaVersion 1).",
  "$defs": {
    "CiInfo": {
      "properties": {
        "repository": {
          "anyOf": [
            {
              "type": "string"
            },
            {
              "type": "null"
            }
          ],
          "default": null,
          "title": "Repository"
        },
        "sha": {
          "anyOf": [
            {
              "type": "string"
            },
            {
              "type": "null"
            }
          ],
          "default": null,
          "title": "Sha"
        },
        "ref": {
          "anyOf": [
            {
              "type": "string"
            },
            {
              "type": "null"
            }
          ],
          "default": null,
          "title": "Ref"
        },
        "runId": {
          "anyOf": [
            {
              "type": "string"
            },
            {
              "type": "null"
            }
          ],
          "default": null,
          "title": "Runid"
        },
        "runAttempt": {
          "anyOf": [
            {
              "type": "string"
            },
            {
              "type": "null"
            }
          ],
          "default": null,
          "title": "Runattempt"
        },
        "serverUrl": {
          "anyOf": [
            {
              "type": "string"
            },
            {
              "type": "null"
            }
          ],
          "default": null,
          "title": "Serverurl"
        }
      },
      "title": "CiInfo",
      "type": "object"
    },
    "Failure": {
      "properties": {
        "phase": {
          "enum": [
            "setup",
            "server-start",
            "client-join",
            "scenario",
            "teardown"
          ],
          "title": "Phase",
          "type": "string"
        },
        "message": {
          "title": "Message",
          "type": "string"
        },
        "stepIndex": {
          "anyOf": [
            {
              "type": "integer"
            },
            {
              "type": "null"
            }
          ],
          "default": null,
          "title": "Stepindex"
        }
      },
      "required": [
        "phase",
        "message"
      ],
      "title": "Failure",
      "type": "object"
    },
    "FukurouInfo": {
      "properties": {
        "version": {
          "title": "Version",
          "type": "string"
        },
        "portablemc": {
          "title": "Portablemc",
          "type": "string"
        }
      },
      "required": [
        "version",
        "portablemc"
      ],
      "title": "FukurouInfo",
      "type": "object"
    },
    "JavaInfo": {
      "properties": {
        "server": {
          "anyOf": [
            {
              "type": "integer"
            },
            {
              "type": "null"
            }
          ],
          "default": null,
          "title": "Server"
        }
      },
      "title": "JavaInfo",
      "type": "object"
    },
    "LogInfo": {
      "properties": {
        "kind": {
          "enum": [
            "harness",
            "server",
            "client",
            "crash"
          ],
          "title": "Kind",
          "type": "string"
        },
        "path": {
          "title": "Path",
          "type": "string"
        },
        "player": {
          "anyOf": [
            {
              "type": "string"
            },
            {
              "type": "null"
            }
          ],
          "default": null,
          "title": "Player"
        }
      },
      "required": [
        "kind",
        "path"
      ],
      "title": "LogInfo",
      "type": "object"
    },
    "MinecraftInfo": {
      "properties": {
        "version": {
          "title": "Version",
          "type": "string"
        },
        "server": {
          "const": "paper",
          "default": "paper",
          "title": "Server",
          "type": "string"
        },
        "build": {
          "anyOf": [
            {
              "type": "integer"
            },
            {
              "type": "null"
            }
          ],
          "default": null,
          "title": "Build"
        },
        "channel": {
          "anyOf": [
            {
              "type": "string"
            },
            {
              "type": "null"
            }
          ],
          "default": null,
          "title": "Channel"
        }
      },
      "required": [
        "version"
      ],
      "title": "MinecraftInfo",
      "type": "object"
    },
    "PlayerInfo": {
      "properties": {
        "name": {
          "title": "Name",
          "type": "string"
        },
        "op": {
          "default": false,
          "title": "Op",
          "type": "boolean"
        },
        "joined": {
          "default": false,
          "title": "Joined",
          "type": "boolean"
        }
      },
      "required": [
        "name"
      ],
      "title": "PlayerInfo",
      "type": "object"
    },
    "PluginInfo": {
      "properties": {
        "file": {
          "title": "File",
          "type": "string"
        },
        "sha256": {
          "title": "Sha256",
          "type": "string"
        },
        "name": {
          "anyOf": [
            {
              "type": "string"
            },
            {
              "type": "null"
            }
          ],
          "default": null,
          "title": "Name"
        },
        "version": {
          "anyOf": [
            {
              "type": "string"
            },
            {
              "type": "null"
            }
          ],
          "default": null,
          "title": "Version"
        },
        "role": {
          "enum": [
            "under-test",
            "dependency"
          ],
          "title": "Role",
          "type": "string"
        },
        "source": {
          "anyOf": [
            {
              "type": "string"
            },
            {
              "type": "null"
            }
          ],
          "default": null,
          "title": "Source"
        },
        "classFileMajor": {
          "anyOf": [
            {
              "type": "integer"
            },
            {
              "type": "null"
            }
          ],
          "default": null,
          "title": "Classfilemajor"
        },
        "enabled": {
          "anyOf": [
            {
              "type": "boolean"
            },
            {
              "type": "null"
            }
          ],
          "default": null,
          "title": "Enabled"
        }
      },
      "required": [
        "file",
        "sha256",
        "role"
      ],
      "title": "PluginInfo",
      "type": "object"
    },
    "ScenarioInfo": {
      "properties": {
        "name": {
          "title": "Name",
          "type": "string"
        },
        "source": {
          "title": "Source",
          "type": "string"
        },
        "sha256": {
          "title": "Sha256",
          "type": "string"
        }
      },
      "required": [
        "name",
        "source",
        "sha256"
      ],
      "title": "ScenarioInfo",
      "type": "object"
    },
    "ScreenshotInfo": {
      "properties": {
        "player": {
          "title": "Player",
          "type": "string"
        },
        "name": {
          "title": "Name",
          "type": "string"
        },
        "path": {
          "title": "Path",
          "type": "string"
        },
        "width": {
          "title": "Width",
          "type": "integer"
        },
        "height": {
          "title": "Height",
          "type": "integer"
        },
        "stepIndex": {
          "anyOf": [
            {
              "type": "integer"
            },
            {
              "type": "null"
            }
          ],
          "default": null,
          "title": "Stepindex"
        }
      },
      "required": [
        "player",
        "name",
        "path",
        "width",
        "height"
      ],
      "title": "ScreenshotInfo",
      "type": "object"
    },
    "StepResult": {
      "properties": {
        "index": {
          "title": "Index",
          "type": "integer"
        },
        "on": {
          "anyOf": [
            {
              "type": "string"
            },
            {
              "type": "null"
            }
          ],
          "default": null,
          "title": "On"
        },
        "action": {
          "title": "Action",
          "type": "string"
        },
        "label": {
          "title": "Label",
          "type": "string"
        },
        "status": {
          "enum": [
            "passed",
            "failed",
            "skipped"
          ],
          "title": "Status",
          "type": "string"
        },
        "durationMs": {
          "anyOf": [
            {
              "type": "integer"
            },
            {
              "type": "null"
            }
          ],
          "default": null,
          "title": "Durationms"
        },
        "error": {
          "anyOf": [
            {
              "type": "string"
            },
            {
              "type": "null"
            }
          ],
          "default": null,
          "title": "Error"
        },
        "screenshot": {
          "anyOf": [
            {
              "type": "string"
            },
            {
              "type": "null"
            }
          ],
          "default": null,
          "title": "Screenshot"
        }
      },
      "required": [
        "index",
        "action",
        "label",
        "status"
      ],
      "title": "StepResult",
      "type": "object"
    }
  },
  "properties": {
    "schemaVersion": {
      "const": 1,
      "default": 1,
      "title": "Schemaversion",
      "type": "integer"
    },
    "id": {
      "title": "Id",
      "type": "string"
    },
    "status": {
      "enum": [
        "passed",
        "failed",
        "error"
      ],
      "title": "Status",
      "type": "string"
    },
    "fukurou": {
      "$ref": "#/$defs/FukurouInfo"
    },
    "minecraft": {
      "$ref": "#/$defs/MinecraftInfo"
    },
    "java": {
      "$ref": "#/$defs/JavaInfo",
      "default": {
        "server": null
      }
    },
    "scenario": {
      "anyOf": [
        {
          "$ref": "#/$defs/ScenarioInfo"
        },
        {
          "type": "null"
        }
      ],
      "default": null
    },
    "plugins": {
      "default": [],
      "items": {
        "$ref": "#/$defs/PluginInfo"
      },
      "title": "Plugins",
      "type": "array"
    },
    "players": {
      "default": [],
      "items": {
        "$ref": "#/$defs/PlayerInfo"
      },
      "title": "Players",
      "type": "array"
    },
    "steps": {
      "default": [],
      "items": {
        "$ref": "#/$defs/StepResult"
      },
      "title": "Steps",
      "type": "array"
    },
    "failure": {
      "anyOf": [
        {
          "$ref": "#/$defs/Failure"
        },
        {
          "type": "null"
        }
      ],
      "default": null
    },
    "screenshots": {
      "default": [],
      "items": {
        "$ref": "#/$defs/ScreenshotInfo"
      },
      "title": "Screenshots",
      "type": "array"
    },
    "logs": {
      "default": [],
      "items": {
        "$ref": "#/$defs/LogInfo"
      },
      "title": "Logs",
      "type": "array"
    },
    "startedAt": {
      "title": "Startedat",
      "type": "string"
    },
    "finishedAt": {
      "anyOf": [
        {
          "type": "string"
        },
        {
          "type": "null"
        }
      ],
      "default": null,
      "title": "Finishedat"
    },
    "durationMs": {
      "anyOf": [
        {
          "type": "integer"
        },
        {
          "type": "null"
        }
      ],
      "default": null,
      "title": "Durationms"
    },
    "ci": {
      "anyOf": [
        {
          "$ref": "#/$defs/CiInfo"
        },
        {
          "type": "null"
        }
      ],
      "default": null
    }
  },
  "required": [
    "id",
    "status",
    "fukurou",
    "minecraft",
    "startedAt"
  ],
  "title": "ResultV1",
  "type": "object"
}
